{
  "$schema": "https://aos-data.org/schema/hero.schema.json",
  "id": "doralia-ven-denst",
  "name": "Doralia ven Denst",
  "faction": "cities-of-sigmar",
  "points": 0,
  "stats": {
    "move": "5\"",
    "health": 5,
    "save": "4+",
    "control": 2
  },
  "role": "other",
  "keywords": [
    "CITIES OF SIGMAR",
    "HERO",
    "HUMAN",
    "INFANTRY",
    "ORDER",
    "UNIQUE"
  ],
  "baseSize": 1,
  "weapons": [
    {
      "name": "Consecrated Blade",
      "type": "melee",
      "attacks": 3,
      "hit": "3+",
      "wound": "4+",
      "rend": 1,
      "damage": 2
    },
    {
      "name": "Anti‑thaumic Crossbow",
      "type": "ranged",
      "attacks": 2,
      "hit": "3+",
      "wound": "3+",
      "rend": 1,
      "damage": 2,
      "range": "18\"",
      "abilities": [
        "Anti‑**^^Wizard^^** (+1 Rend)"
      ]
    }
  ],
  "_meta": {
    "lastUpdated": "2026-01-07",
    "source": "BSData import"
  },
  "grandAlliance": "order",
  "regimentKeywords": [
    "CITIES OF SIGMAR",
    "HUMAN"
  ],
  "abilities": [
    {
      "name": "Weapons of Banishment",
      "type": "passive",
      "effect": "Double the Damage characteristic of this unit’s weapons for attacks that target **^^Wizards^^**, **^^Priests^^** and **^^Manifestations^^**.",
      "color": "Red",
      "abilityCategory": "Offensive"
    }
  ],
  "publication": {
    "name": "Faction Pack: Cities of Sigmar"
  },
  "isWizard": null,
  "isPriest": null,
  "isUnique": true,
  "canJoinRegiment": null
}
