{
  "$schema": "https://aos-data.org/schema/hero.schema.json",
  "id": "glutos-orscollion-lord-of-gluttony",
  "name": "Glutos Orscollion, Lord of Gluttony",
  "faction": "hedonites-of-slaanesh",
  "points": 440,
  "stats": {
    "move": "8\"",
    "health": 18,
    "save": "4+",
    "control": 5
  },
  "role": "other",
  "keywords": [
    "CHAOS",
    "HEDONITES OF SLAANESH",
    "HERO",
    "SYBARITE",
    "UNIQUE",
    "WAR MACHINE",
    "WARD (5+)",
    "WARMASTER",
    "WIZARD (2)"
  ],
  "baseSize": 1,
  "weapons": [
    {
      "name": "Greatblade and Claws",
      "type": "melee",
      "attacks": 1,
      "hit": "3+",
      "wound": "4+",
      "rend": 0,
      "damage": 1,
      "abilities": [
        "Companion"
      ]
    },
    {
      "name": "Leerstave of Loth’shar",
      "type": "ranged",
      "attacks": 1,
      "hit": "2+",
      "wound": "4+",
      "rend": 0,
      "damage": 1,
      "range": "12\"",
      "abilities": [
        "Shoot in Combat"
      ]
    },
    {
      "name": "Scourge and Dagger",
      "type": "melee",
      "attacks": 1,
      "hit": "3+",
      "wound": "4+",
      "rend": 0,
      "damage": 1,
      "abilities": [
        "Companion"
      ]
    }
  ],
  "_meta": {
    "lastUpdated": "2026-01-06",
    "source": "BSData import"
  },
  "grandAlliance": "chaos",
  "regimentKeywords": [
    "HEDONITES OF SLAANESH",
    "SYBARITE",
    "WARD (5+)",
    "WIZARD (2)"
  ],
  "abilities": [
    {
      "name": "Gorge on Excess",
      "type": "passive",
      "effect": "**Heal (6)** the target.",
      "phase": "any",
      "declare": "Pick a friendly **^^Sybarite^^** unit wholly within 12\" of this unit to be the target."
    },
    {
      "name": "The Grand Gourmand",
      "type": "passive",
      "effect": "A different effect applies to friendly **^^Sybarite^^** units each battle round while they are wholly within 12\" of this unit, as shown below. The effects of all previous battle rounds also apply to those units while they are wholly within 12\" of this unit.\n**Battle Round 1:**\n***Starter:*** Add 1 to run rolls and charge rolls for those units.\n**Battle Round 2:**\n***Main:*** Add 3 to those units’ control scores.\n**Battle Round 3:**\n***Dessert:*** Add 1 to hit rolls for those unit’s attacks.\n**Battle Round 4+:**\n***Digestif:*** Add 1 to the Rend characteristic of those units’ melee weapons."
    },
    {
      "name": "Crippling Famishment",
      "type": "spell",
      "effect": "Until the start of your next turn:\n• Halve the target’s Move characteristic.\n• Halve run rolls and charge rolls for the target.",
      "phase": "hero",
      "declare": "Pick a visible enemy unit within 18\" of this unit to be the target, then make a casting roll of 2D6.",
      "castingValue": 7,
      "keywords": [
        "**^^SPELL^^**"
      ]
    },
    {
      "name": "Battle Damaged",
      "type": "passive",
      "effect": "While this unit has 10 or more damage points, the Attacks characteristic of its **Greatblade and Claws** is 6."
    }
  ],
  "isWizard": null,
  "isPriest": null,
  "isUnique": true,
  "canJoinRegiment": null
}
