{
  "$schema": "https://aos-data.org/schema/hero.schema.json",
  "id": "killaboss-on-great-gnashtoof",
  "name": "Killaboss on Great Gnashtoof",
  "faction": "kruleboyz",
  "points": 150,
  "stats": {
    "move": "10\"",
    "health": 10,
    "save": "3+",
    "control": 2
  },
  "role": "other",
  "keywords": [
    "CAVALRY",
    "DESTRUCTION",
    "HERO",
    "KRULEBOYZ"
  ],
  "baseSize": 1,
  "weapons": [
    {
      "name": "Boss-stikka",
      "type": "melee",
      "attacks": 1,
      "hit": "4+",
      "wound": "4+",
      "rend": 0,
      "damage": 1,
      "abilities": [
        "Crit (Mortal)"
      ]
    },
    {
      "name": "Great Gnashtoof’s Jaws",
      "type": "melee",
      "attacks": 1,
      "hit": "4+",
      "wound": "4+",
      "rend": 0,
      "damage": 1,
      "abilities": [
        "Companion"
      ]
    }
  ],
  "_meta": {
    "lastUpdated": "2026-01-06",
    "source": "BSData import"
  },
  "grandAlliance": "destruction",
  "regimentKeywords": [
    "KRULEBOYZ"
  ],
  "abilities": [
    {
      "name": "That's Ours, Ya Gitz",
      "type": "passive",
      "effect": "While this unit is contesting an objective you do not control, add 1 to hit rolls for combat attacks made by friendly **^^Kruleboyz^^** units wholly within 12\" of this unit.",
      "color": "Red",
      "abilityCategory": "Offensive"
    },
    {
      "name": "All Part of da Plan",
      "type": "passive",
      "effect": "Add 3 to the target’s control score until the start of your next turn.",
      "phase": "hero",
      "declare": "Pick another friendly **^^Kruleboyz^^** unit wholly within 9\" of this unit to be the target.",
      "color": "Yellow",
      "abilityCategory": "Control"
    }
  ],
  "publication": {
    "name": "Battletome: Orruk Warclans"
  },
  "isWizard": null,
  "isPriest": null,
  "isUnique": false,
  "canJoinRegiment": null
}
