{
  "$schema": "https://aos-data.org/schema/hero.schema.json",
  "id": "knight-heraldor",
  "name": "Knight-Heraldor",
  "faction": "stormcast-eternals",
  "points": 110,
  "stats": {
    "move": "5\"",
    "health": 6,
    "save": "3+",
    "control": 2
  },
  "role": "other",
  "keywords": [
    "HERO",
    "INFANTRY",
    "LEGENDS",
    "ORDER",
    "STORMCAST ETERNALS",
    "WARRIOR CHAMBER"
  ],
  "baseSize": 1,
  "weapons": [
    {
      "name": "Sigmarite Broadsword",
      "type": "melee",
      "attacks": 1,
      "hit": "3+",
      "wound": "4+",
      "rend": 0,
      "damage": 1
    }
  ],
  "_meta": {
    "lastUpdated": "2026-01-07",
    "source": "BSData import"
  },
  "grandAlliance": "order",
  "regimentKeywords": [
    "LEGENDS",
    "STORMCAST ETERNALS",
    "WARRIOR CHAMBER"
  ],
  "abilities": [
    {
      "name": "Thunderblast",
      "type": "passive",
      "effect": "Roll a dice. On a 2+, inflict an amount of mortal damage on the target equal to the roll.",
      "phase": "shooting",
      "declare": "Pick a visible faction terrain feature within 18\" of this unit to be the target.",
      "color": "Blue",
      "abilityCategory": "Shooting"
    },
    {
      "name": "Call to Battle",
      "type": "passive",
      "effect": "If a friendly **^^Warrior Chamber^^** unit wholly within 12\" of this unit uses the ‘Rally’ command, you can make 3 additional rally rolls of D6.",
      "color": "Yellow",
      "abilityCategory": "Rallying"
    }
  ],
  "publication": {
    "name": "Battletome Supplement: Stormcast Eternals"
  },
  "isWizard": null,
  "isPriest": null,
  "isUnique": false,
  "canJoinRegiment": null,
  "regimentAllows": [
    {
      "keywords": [
        "WARRIOR CHAMBER"
      ],
      "description": "Units with WARRIOR CHAMBER keyword"
    }
  ]
}
