{
  "$schema": "https://aos-data.org/schema/hero.schema.json",
  "id": "eidolon-of-mathlann-aspect-of-the-sea",
  "name": "Eidolon of Mathlann, Aspect of the Sea",
  "faction": "idoneth-deepkin",
  "points": 340,
  "stats": {
    "move": "10\"",
    "health": 12,
    "save": "3+",
    "control": 5
  },
  "role": "other",
  "keywords": [
    "AELF",
    "EIDOLON",
    "FLY",
    "HERO",
    "IDONETH DEEPKIN",
    "MONSTER",
    "ORDER",
    "WARD (5+)",
    "WIZARD (2)"
  ],
  "baseSize": 1,
  "weapons": [
    {
      "name": "Blasts of Abyssal Energy",
      "type": "ranged",
      "attacks": 1,
      "hit": "3+",
      "wound": "4+",
      "rend": 0,
      "damage": 1,
      "range": "12\""
    },
    {
      "name": "Psi-trident and Deep-sea Sceptre",
      "type": "melee",
      "attacks": 1,
      "hit": "3+",
      "wound": "4+",
      "rend": 0,
      "damage": 1
    }
  ],
  "_meta": {
    "lastUpdated": "2026-01-06",
    "source": "BSData import"
  },
  "grandAlliance": "order",
  "regimentKeywords": [
    "AELF",
    "EIDOLON",
    "FLY",
    "IDONETH DEEPKIN",
    "WARD (5+)",
    "WIZARD (2)"
  ],
  "abilities": [
    {
      "name": "Dormant Energies",
      "type": "passive",
      "effect": "Add 1 to casting rolls for this unit.",
      "color": "Yellow",
      "abilityCategory": "Special"
    },
    {
      "name": "Tranquillity of the Abyss",
      "type": "passive",
      "effect": "Ignore negative modifiers to the control scores of friendly **^^Idoneth Deepkin^^** units while they are wholly within 12\" of this unit.",
      "color": "Purple",
      "abilityCategory": "Control"
    },
    {
      "name": "Vengeful Waves",
      "type": "once-per-turn",
      "effect": "Roll a dice. On a 3+, the target cannot use commands for the rest of the turn.",
      "phase": "charge",
      "declare": "If this unit has not charged this turn, pick an enemy unit in combat with it to be the target.",
      "keywords": [
        "**^^RAMPAGE^^**"
      ],
      "color": "Orange",
      "abilityCategory": "Special"
    },
    {
      "name": "Tsunami of Terror",
      "type": "spell",
      "effect": "Subtract 1 from save rolls for combat attacks that target those units until the start of your next turn.",
      "phase": "hero",
      "declare": "Pick up to 3 different visible enemy units within 12\" of this unit to be the targets, then make a casting roll of 2D6.",
      "castingValue": 7,
      "keywords": [
        "**^^SPELL^^**"
      ],
      "color": "Yellow",
      "abilityCategory": "Offensive"
    }
  ],
  "publication": {
    "name": "Battletome: Idoneth Deepkin"
  },
  "isWizard": 2,
  "isPriest": null,
  "isUnique": false,
  "canJoinRegiment": null
}
