{
  "$schema": "https://aos-data.org/schema/hero.schema.json",
  "id": "ogroid-myrmidon",
  "name": "Ogroid Myrmidon",
  "faction": "slaves-to-darkness",
  "points": 120,
  "stats": {
    "move": "6\"",
    "health": 8,
    "save": "4+",
    "control": 2
  },
  "role": "other",
  "keywords": [
    "CHAOS",
    "HERO",
    "INFANTRY",
    "SLAVES TO DARKNESS"
  ],
  "baseSize": 1,
  "weapons": [
    {
      "name": "Gladiator Spear",
      "type": "melee",
      "attacks": 1,
      "hit": "3+",
      "wound": "4+",
      "rend": 0,
      "damage": 1,
      "abilities": [
        "Anti-**^^Monster^^** (+1 Rend)"
      ]
    }
  ],
  "_meta": {
    "lastUpdated": "2026-01-06",
    "source": "BSData import"
  },
  "grandAlliance": "chaos",
  "regimentKeywords": [
    "SLAVES TO DARKNESS"
  ],
  "abilities": [
    {
      "name": "Myrmidon Rage",
      "type": "passive",
      "effect": "While this unit is damaged, add 2 to the Attacks characteristic of its melee weapons."
    },
    {
      "name": "Pit Master",
      "type": "reaction",
      "effect": "Pick a friendly **Ogroid Theridons** unit that has not used a **^^Fight^^** ability this turn and is within this unit’s combat range to be the target. The target can be picked to use a **^^Fight^^** ability immediately after the **^^Fight^^** ability used by this unit has been resolved. If it is picked to do so, add 1 to hit rolls for the target’s attacks for the rest of the turn."
    }
  ],
  "isWizard": null,
  "isPriest": null,
  "isUnique": false,
  "canJoinRegiment": null
}
