{
  "$schema": "https://aos-data.org/schema/hero.schema.json",
  "id": "snarlboss",
  "name": "Snarlboss",
  "faction": "gloomspite-gitz",
  "points": 120,
  "stats": {
    "move": "12\"",
    "health": 5,
    "save": "5+",
    "control": 2
  },
  "role": "other",
  "keywords": [
    "CAVALRY",
    "DESTRUCTION",
    "GITMOB",
    "GLOOMSPITE GITZ",
    "HERO"
  ],
  "baseSize": 1,
  "weapons": [
    {
      "name": "Snarlfang's Slavering Jaws",
      "type": "melee",
      "attacks": 1,
      "hit": "4+",
      "wound": "4+",
      "rend": 0,
      "damage": 1,
      "abilities": [
        "Companion"
      ]
    },
    {
      "name": "Boss Loppa",
      "type": "melee",
      "attacks": 1,
      "hit": "4+",
      "wound": "4+",
      "rend": 0,
      "damage": 1
    }
  ],
  "_meta": {
    "lastUpdated": "2026-01-07",
    "source": "BSData import"
  },
  "grandAlliance": "destruction",
  "regimentKeywords": [
    "GITMOB",
    "GLOOMSPITE GITZ"
  ],
  "abilities": [
    {
      "name": "Vicious Snarls and Great Howls",
      "type": "once-per-turn",
      "effect": "For the rest of the turn, add 1 to the Attacks characteristic of the targets' **Companion** melee weapons.",
      "phase": "combat",
      "declare": "If this unit charged this turn, pick this unit and up to 2 friendly **^^Gitmob Cavalry^^** units within this unit's combat range to be the targets.",
      "color": "Red",
      "abilityCategory": "Offensive"
    },
    {
      "name": "Boss Snarlfang",
      "type": "passive",
      "effect": "Add 2 to charge rolls for friendly **^^Gitmob Cavalry^^** units while they are wholly within 12\" of this unit.",
      "color": "Orange",
      "abilityCategory": "Movement"
    }
  ],
  "publication": {
    "name": "Battletome: Gloomspite Gitz"
  },
  "isWizard": null,
  "isPriest": null,
  "isUnique": false,
  "canJoinRegiment": null
}
