{
  "$schema": "https://aos-data.org/schema/hero.schema.json",
  "id": "daemonsmith-on-infernal-taurus",
  "name": "Daemonsmith on Infernal Taurus",
  "faction": "helsmiths-of-hashut",
  "points": 290,
  "stats": {
    "move": "10\"",
    "health": 15,
    "save": "3+",
    "control": 5
  },
  "role": "other",
  "keywords": [
    "CHAOS",
    "DUARDIN",
    "FLY",
    "HELSMITHS OF HASHUT",
    "HERO",
    "MONSTER",
    "WAR MACHINE",
    "WIZARD (1)"
  ],
  "baseSize": 1,
  "weapons": [
    {
      "name": "Infernal Staff",
      "type": "melee",
      "attacks": 3,
      "hit": "4+",
      "wound": "3+",
      "rend": 1,
      "damage": "D3"
    },
    {
      "name": "Hurled Daemonfire",
      "type": "ranged",
      "attacks": 3,
      "hit": "4+",
      "wound": "4+",
      "rend": 1,
      "damage": "D3",
      "range": "18\"",
      "abilities": [
        "Crit (2 Hits)",
        "Shoot in Combat"
      ]
    },
    {
      "name": "Horns and Hooves",
      "type": "melee",
      "attacks": 6,
      "hit": "4+",
      "wound": "2+",
      "rend": 2,
      "damage": 3,
      "abilities": [
        "Charge (+1 Damage)",
        "Companion"
      ]
    }
  ],
  "_meta": {
    "lastUpdated": "2026-01-08",
    "source": "BSData import"
  },
  "grandAlliance": "chaos",
  "regimentKeywords": [
    "DUARDIN",
    "FLY",
    "HELSMITHS OF HASHUT",
    "WIZARD (1)"
  ],
  "abilities": [
    {
      "name": "Unholy Stampede",
      "type": "passive",
      "effect": "While a friendly **^^Helsmiths of Hashut Cavalry^^** unit is wholly within 12\" of this unit:\n• That unit can use a **^^Retreat^^** ability and still use **^^Charge^^** abilities later in the turn.\n• No mortal damage is inflicted on that unit by **^^Retreat^^** abilities.",
      "color": "Black",
      "abilityCategory": "Special"
    },
    {
      "name": "Battle Damaged",
      "type": "passive",
      "effect": "While this unit has 10 or more damage points, the Attacks characteristic of its **Horns and Hooves** is 4.",
      "color": "Black"
    },
    {
      "name": "Immolating Presence",
      "type": "once-per-turn",
      "effect": "Roll a dice. If the roll exceeds the target's Health characteristic, 1 model in the target unit is slain.",
      "phase": "any",
      "declare": "Pick an enemy unit in combat with this unit to be the target.",
      "keywords": [
        "**^^RAMPAGE^^**"
      ],
      "color": "Purple",
      "abilityCategory": "Offensive"
    },
    {
      "name": "Daemonic Resilience",
      "type": "passive",
      "effect": "Apply the effect below that corresponds with the number of **daemonic power points** this unit has:\n**1** This unit has **^^Ward (6+)^^**.\n**2** This unit has **^^Ward (5+)^^**.\n**3** This unit has **^^Ward (4+)^^** against damage inflicted by **^^Spells^^**, **^^Prayers^^**, and abilites used by **^^Manifestations^^**. Otherwise, it has **^^Ward (5+)^^**.",
      "color": "Green",
      "abilityCategory": "Defensive"
    }
  ],
  "publication": {
    "name": "Battletome: Helsmiths of Hashut"
  },
  "isWizard": 1,
  "isPriest": null,
  "isUnique": false,
  "canJoinRegiment": null
}
